

{
    "$schema": "https://json-schema.org/draft/2020-12/schema",
    "$id": "https://example.com/schemas/flowchart-ir/v1",
    "title": "Intermediate Representation for a Static Flowchart",
    "description": "IR for making flowcharts accessible to visually impaired persons",
    "type": "object",
    "required": ["id", "elements", "structure", "state", "semantics"],
    "additionalProperties": false,

    "properties": {
      "id": {
        "type": "string",
        "format": "date-time",
        "description": "Unique identifier for this flowchart"
      },

      "elements": {
        "type": "object",
        "description": "The basic building blocks of a flowchart — vertices and edges",
        "required": ["nodes", "connections"],
        "additionalProperties": false,
        "properties": {

          "nodes": {
            "type": "array",
            "minItems": 1,
            "items": {
              "type": "object",
              "required": ["shape", "text", "id"],
              "additionalProperties": false,
              "properties": {
                "id": { "type": "string" },
                "shape": {
                  "type": "string",
                  "enum": [
                    "rectangle",
                    "diamond",
                    "oval",
                    "parallelogram",
                    "circle",
                    "rounded-rectangle", 
			              "triangle",
                    "other"
                  ]
                },
                "text": { "type": "string" },
                "position": { "$ref": "#/$defs/position" },
                "visual": { "$ref": "#/$defs/visualAttrs" }
              }
            }
          },

          "connections": {
            "type": "array",
            "items": {
              "type": "object",
              "required": ["id", "source", "target"],
              "additionalProperties": false,
              "properties": {
                "id": { "type": "string" },
                "source": {
                  "type": "string",
                  "description": "ID of the source node"
                },
                "target": {
                  "type": "string",
                  "description": "ID of the target node"
                },
                "direction": {
                  "type": "string",
                  "enum": ["forward", "backward", "bidirectional", "none"],
                  "default": "forward"
                },
                "line-type": {
                  "type": "string",
                  "enum": ["solid", "dashed", "dotted"],
                  "default": "solid"
                },
                "label": { "type": "string" },
                "visual": { "$ref": "#/$defs/visualAttrs" }
              }
            }
          }
        }
      },

      "structure": {
        "type": "object",
        "description": "Organization, complexity management, and cross-graph relationships",
        "additionalProperties": false,
        "properties": {

          "hierarchy": {
            "type": "array",
            "description": "Logical groupings and parent-child relationships",
            "items": {
              "type": "object",
              "required": ["id", "parent", "children"],
              "additionalProperties": false,
              "properties": {
                "id": { "type": "string" },
                "label": { "type": "string" },
                "parent": {
                  "type": ["string", "null"],
                  "description": "ID of parent group for nesting,  set to null when flat grouping"
                },
                "children": {
                  "type": "array",
                  "minItems": 1,
                  "items": { "type": "string" },
                  "description": "IDs of nodes or sub-groups belonging to this group"
                }
              }
            }
          }
        }
      },

      "state": {
        "type": "object",
        "description": "The current state of the entire frame",
        "additionalProperties": false,
        "properties": {

          "crossLinks": {
            "type": "array",
            "description": "Architectural relationships between flowcharts on the same board",
            "items": {
              "type": "object",
              "required": ["sourceFlowchart", "targetFlowchart", "sourceElement", "targetElement"],
              "additionalProperties": false,
              "properties": {
                "sourceFlowchart": {
                  "type": "string",
                  "description": "ID of the flowchart with outgoing link"
                },
                "targetFlowchart": {
                  "type": "string",
                  "description": "ID of the linked flowchart"
                },
                "sourceElement": {
                  "type": "string",
                  "description": "ID of element in this flowchart"
                },
                "targetElement": {
                  "type": "string",
                  "description": "ID of element in the target flowchart"
                },
                "label": { "type": "string" }
              }
            }
          },


          "compacted": {
            "type": "object",
            "description": "Complexity management through collapsing and summarization",
            "additionalProperties": false,
            "properties": {
              "detailLevel": {
                "type": "string",
                "oneOf": [
                  {
                    "const": "full",
                    "description": "All nodes and connections visible"
                  },
                  {
                    "const": "summary",
                    "description": "Collapsed groups shown as single summary nodes"
                  },
                  {
                    "const": "minimal",
                    "description": "Only top-level flow with group summaries"
                  }
                ]
              },
              "collapsedGroups": {
                "type": "array",
                "items": { "type": "string" },
                "description": "IDs of hierarchy groups currently collapsed"
              },
              "summaries": {
                "type": "array",
                "description": "Text summaries for collapsed regions",
                "items": {
                  "type": "object",
                  "required": ["groupId", "summary"],
                  "additionalProperties": false,
                  "properties": {
                    "groupId": { "type": "string" },
                    "summary": { "type": "string" }
                  }
                }
              }
            }
          },

          "boardState": {
            "type": "string",
            "description": "Plain-text description of the current board state"
          }
        }
      },

      "semantics": {
        "type": "object",
        "description": "Meaning, interpretation, and commentary layers for consumption",
        "additionalProperties": false,
        "properties": {

          "narrative": {
            "type": "object",
            "description": "Context for the flowchart",
            "additionalProperties": false,
            "properties": {
              "overview": {
                "type": "string",
                "description": "High-level description of what this flowchart represents"
              },
              "purpose": {
                "type": "string",
                "description": "Why this flowchart exists in the learning material"
              },
              "dialogue": {
                "type": "string",
                "description": "Current context in which this flowchart is being talked about"
              },
              "walkthrough": {
                "type": "array",
                "description": "Ordered narrative steps for guided screen reader traversal",
                "items": {
                  "type": "object",
                  "required": ["elementId", "narration"],
                  "additionalProperties": false,
                  "properties": {
                    "elementId": { "type": "string" },
                    "narration": { "type": "string" }
                  }
                }
              }
            }
          },

          "symbols": {
            "type": "array",
            "description": "Semantic meaning of shapes and visual conventions, defined once as a lookup table",
            "items": {
              "type": "object",
              "required": ["symbol", "meaning"],
              "additionalProperties": false,
              "properties": {
                "symbol": { "type": "string" },
                "meaning": {
                  "type": "string",
                  "description": "What this symbol represents (e.g., 'diamond' means 'decision point')"
                },
                "applicableTo": {
                  "type": "array",
                  "items": { "type": "string" },
                  "description": "IDs of elements using this symbol"
                }
              }
            }
          },

          "annotations": {
            "type": "array",
            "description": "Interpretive overlays on elements — highlighting, emphasis, instructor commentary",
            "items": {
              "type": "object",
              "required": ["id", "target", "annotationType"],
              "additionalProperties": false,
              "properties": {
                "id": { "type": "string" },
                "target": {
                  "type": "string",
                  "description": "ID of the annotated node or connection in the elements group"
                },
                "annotationType": {
                  "type": "string",
                  "enum": [
		               "container",
			             "separator",
                    "highlight",
                    "circle",
                    "underline",
                    "arrow",
                    "cloud",
                    "strikethrough"
                  ]
                },
                "content": {
                  "type": ["string", "null"],
                  "description": "Text content or note attached to the annotation"
                }
              }
            }
          }
        }
      }
    },

    "$defs": {
      "position": {
        "type": "object",
        "additionalProperties": false,
        "required": ["x", "y"],
        "properties": {
          "x": { "type": "number" },
          "y": { "type": "number" }
        }
      },
      "visualAttrs": {
        "type": "object",
        "description": "Visual properties of nodes and connections",
        "additionalProperties": false,
        "properties": {
          "color": { "type": "string" }

        }
      }
    }
  }




